{
  "$schema": "https://json-schema.org/draft/2020-12/schema",
  "$id": "https://reflection-lab.local/schemas/wiki-event.schema.json",
  "title": "Immutable wiki event",
  "type": "object",
  "required": ["id", "type", "created_at", "agent", "session", "summary", "task_id", "details"],
  "properties": {
    "id": { "type": "string", "format": "uuid" },
    "type": { "type": "string", "minLength": 1 },
    "created_at": { "type": "string", "format": "date-time" },
    "agent": { "type": "string", "minLength": 1 },
    "session": { "type": "string", "minLength": 1 },
    "summary": { "type": "string", "minLength": 1 },
    "task_id": { "type": ["string", "null"] },
    "details": { "type": "object" }
  },
  "additionalProperties": false
}
