{
  "id": "d1ff138d-4109-4d1f-89ac-58d1ea1e2f8d",
  "type": "task.heartbeat",
  "created_at": "2026-10-28T15:30:55.675Z",
  "agent": "codex-root",
  "session": "v1-20261028-r14",
  "summary": "RLAB-TASK-0012 heartbeat",
  "task_id": "RLAB-TASK-0012",
  "details": {
    "status": "IN_PROGRESS",
    "owner": {
      "agent": "codex-root",
      "session": "v1-20261028-r14",
      "token": "aaf678db-e0c1-4ebf-9447-af5f8f7b5446",
      "claimed_at": "2026-10-28T09:49:13.292Z",
      "heartbeat_at": "2026-10-28T15:30:55.610Z",
      "lease_until": "2026-10-28T16:30:55.610Z"
    }
  }
}
