{
  "id": "1638c3ae-88fc-4045-83bb-99e7779fb1c2",
  "type": "ingest",
  "created_at": "2026-10-27T06:00:08.294Z",
  "agent": "codex-root",
  "session": "v1-20261027",
  "summary": "第一版coreGit／完整產品4案／雙語8＋13／跨引擎實況checkpoint；整體未完成",
  "task_id": null,
  "details": {
    "source_id": "V1-SRC-0015",
    "source_hash": "2240cb8d97c2ce5cb791dbdd40e0de8e02f178ce1f0808479f44c0f0e1d7d61e",
    "pages": [
      "wiki/now.md",
      "wiki/experiments/record-replay.md",
      "wiki/architecture/runtime-and-contracts.md",
      "wiki/features/sound-behaviors.md"
    ]
  }
}
