{
  "id": "42ee0a07-7d63-4767-80aa-5ae967eac969",
  "type": "task.update",
  "created_at": "2026-10-28T16:20:47.341Z",
  "agent": "codex-root",
  "session": "v1-20261028-r14",
  "summary": "RLAB-TASK-0012 update",
  "task_id": "RLAB-TASK-0012",
  "details": {
    "status": "IN_PROGRESS",
    "owner": {
      "agent": "codex-root",
      "session": "v1-20261028-r14",
      "token": "aaf678db-e0c1-4ebf-9447-af5f8f7b5446",
      "claimed_at": "2026-10-28T09:49:13.292Z",
      "heartbeat_at": "2026-10-28T16:20:29.795Z",
      "lease_until": "2026-10-28T17:20:29.795Z"
    }
  }
}
