{
  "id": "a6f61998-45d3-47b7-a4f9-c3531f3bb7c3",
  "type": "ingest",
  "created_at": "2026-10-27T21:17:02.097Z",
  "agent": "codex-root",
  "session": "v1-20261027",
  "summary": "第一版checkpoint r11：當前完整917品質與英文通過，保留人工性能外部門檻",
  "task_id": null,
  "details": {
    "source_id": "V1-SRC-0031",
    "source_hash": "2fdbd801da4def413887bb87a034d2e63471810e6599e70c0f5c9f7d2ed7ce8e",
    "pages": [
      "wiki/now.md"
    ]
  }
}
