{
  "id": "e9e32962-d5dd-41fe-a232-0bdda4019315",
  "type": "ingest",
  "created_at": "2026-10-29T05:32:09.168Z",
  "agent": "codex-root",
  "session": "architecture-review-20261029",
  "summary": "索引本輪研究／canonical／契約來源新版本；舊hash與events保留",
  "task_id": null,
  "details": {
    "source_id": "AR-WIKI-b90513da-8aff3bb4",
    "source_hash": "8aff3bb47639ea5599936aaa9f23ed709b6882710edb3381d5f528872b11c8aa",
    "pages": [
      "wiki/research/architecture-review-20261029.md"
    ]
  }
}
