{
  "id": "cbcaf8a9-2d28-4e4b-a50a-237cd94fb8ff",
  "type": "ingest",
  "created_at": "2026-10-27T23:39:27.718Z",
  "agent": "codex-root",
  "session": "v1-20261027",
  "summary": "R12完整品質實跑PASS與原生preview清理，最後metadata/Git待收尾",
  "task_id": null,
  "details": {
    "source_id": "V1-SRC-0048",
    "source_hash": "73910aefadfb6aaf8ee5e56f70535e8017a03e6378c6ee7f5dee315be036eb98",
    "pages": [
      "wiki/now.md"
    ]
  }
}
