{
  "id": "c55f4c7d-509b-4952-abf7-ca3ab9fe9d3f",
  "type": "ingest",
  "created_at": "2026-10-26T15:49:44.197Z",
  "agent": "codex-root",
  "session": "phase3-20261026",
  "summary": "Phase3來源與綜合：artifacts/phase3-user-confirmed-muse-status.json",
  "task_id": null,
  "details": {
    "source_id": "RLAB-P3-SRC-0019",
    "source_hash": "0f588cbfa440a6c55611071a5b5eb47643d5170bc8cad6b0f7ad354aafdd2568",
    "pages": [
      "wiki/now.md",
      "wiki/research/muse-models-and-quota.md",
      "wiki/architecture/development-agents.md"
    ]
  }
}
