{
  "id": "d267f0b8-4720-47b3-aca6-df1a28b7cd77",
  "type": "ingest",
  "created_at": "2026-10-28T10:03:11.051Z",
  "agent": "codex-root",
  "session": "v1-20261028-r14",
  "summary": "R14實際FPS7與兩次短追蹤、英文及來源工程進度",
  "task_id": null,
  "details": {
    "source_id": "V1-SRC-0059",
    "source_hash": "f5a2ec9d6c0655e565351073093c303fbbb4736a2e0440d460741baf41a9c88e",
    "pages": [
      "wiki/now.md"
    ]
  }
}
