{
  "id": "2ffee28c-c2ad-44b3-ad0b-289446e6dd44",
  "type": "ingest",
  "created_at": "2026-10-29T05:33:57.626Z",
  "agent": "codex-root",
  "session": "architecture-review-20261029",
  "summary": "索引本輪研究／canonical／契約來源新版本；舊hash與events保留",
  "task_id": null,
  "details": {
    "source_id": "AR-WIKI-a17fbf44-461e799f",
    "source_hash": "461e799f18a050ac495e26538896df8c6d10c5fac2309c5b6cf2573d2c7049f1",
    "pages": [
      "wiki/research/architecture-review-20261029.md"
    ]
  }
}
