{
  "id": "4d45e122-6e60-4bb4-bf04-acb88f66b853",
  "type": "task.heartbeat",
  "created_at": "2026-10-28T12:34:47.402Z",
  "agent": "codex-root",
  "session": "v1-20261028-r14",
  "summary": "RLAB-TASK-0020 heartbeat",
  "task_id": "RLAB-TASK-0020",
  "details": {
    "status": "IN_PROGRESS",
    "owner": {
      "agent": "codex-root",
      "session": "v1-20261028-r14",
      "token": "aafd3b70-2b03-4d55-b569-780f6eea53b5",
      "claimed_at": "2026-10-28T09:49:17.246Z",
      "heartbeat_at": "2026-10-28T12:34:47.307Z",
      "lease_until": "2026-10-28T13:34:47.307Z"
    }
  }
}
