{
  "id": "9db0c63c-6bf5-40f1-b709-1ffe2db070a4",
  "type": "ingest",
  "created_at": "2026-10-28T17:55:09.611Z",
  "agent": "codex-root",
  "session": "v1-20261028-r14",
  "summary": "R17保留Root新8與原28通過、第三產品capture真FAIL，修vacuum錯誤Computed狀態；新正式600未啟動",
  "task_id": null,
  "details": {
    "source_id": "V1-SRC-0068",
    "source_hash": "f324b9192d277dbffc7594c76dba6b90cb5cbcbe86a2d0864f9e140a2a73845b",
    "pages": [
      "wiki/now.md"
    ]
  }
}
