{
  "id": "c127345b-01ad-4c0a-befc-ed45950c4d3c",
  "type": "ingest",
  "created_at": "2026-10-27T02:52:34.965Z",
  "agent": "codex-root",
  "session": "v1-20261027",
  "summary": "V1現行來源版本：docs/ROADMAP.md",
  "task_id": null,
  "details": {
    "source_id": "V1-SRC-0010",
    "source_hash": "a74268aaa0ae505222f7ffe0438bac370634dcd9c3e1915e31d16c01e9650c9a",
    "pages": [
      "wiki/roadmap.md",
      "wiki/goals.md"
    ]
  }
}
