{
  "id": "b879f726-cbe1-421b-961d-1899489cc7fa",
  "type": "task.claim",
  "created_at": "2026-10-26T18:06:18.236Z",
  "agent": "codex-root",
  "session": "sound-readiness-metadata",
  "summary": "RLAB-TASK-0011 claim",
  "task_id": "RLAB-TASK-0011",
  "details": {
    "status": "IN_PROGRESS",
    "owner": {
      "agent": "codex-root",
      "session": "sound-readiness-metadata",
      "token": "ac96dc5b-5a53-4413-a9a5-5903b5c7ffcb",
      "claimed_at": "2026-10-26T18:06:18.110Z",
      "heartbeat_at": "2026-10-26T18:06:18.110Z",
      "lease_until": "2026-10-26T18:11:18.231Z"
    }
  }
}
