{
  "id": "b1660ba4-765a-483b-a762-31231f536885",
  "type": "ingest",
  "created_at": "2026-10-29T13:59:07.775Z",
  "agent": "codex-root",
  "session": "user-feedback-record-20261029-r18",
  "summary": "記錄真人第一人稱阻斷、音量與直接操作問題；限定1至8未提及項目，其他不標成功",
  "task_id": null,
  "details": {
    "source_id": "V1-USER-TEST-20261029-R18",
    "source_hash": "4d3d3fccf295d49c2095f14ec0e679cb92af90b034f16f4717f40fbc66e2842e",
    "pages": [
      "wiki/now.md",
      "wiki/features/interactive-sandbox.md",
      "wiki/ui-ux/design-engineering.md"
    ]
  }
}
