{
  "id": "f04aa09e-9d27-44d6-bfe8-28061f0410cb",
  "type": "ingest",
  "created_at": "2026-10-27T02:52:28.782Z",
  "agent": "codex-root",
  "session": "v1-20261027",
  "summary": "V1現行來源版本：package-lock.json",
  "task_id": null,
  "details": {
    "source_id": "V1-SRC-0007",
    "source_hash": "15a6ad3f0fb014f290925c16399b23b08a2d437e8598b9531e295281b6d4d844",
    "pages": [
      "wiki/architecture/runtime-and-contracts.md"
    ]
  }
}
