{
  "id": "326fa9c8-8898-4bd6-ae48-65cbc14eb063",
  "type": "ingest",
  "created_at": "2026-10-26T15:49:09.441Z",
  "agent": "codex-root",
  "session": "phase3-20261026",
  "summary": "Phase3來源與綜合：docs/NEXT_ENGINEERING_TASK.md",
  "task_id": null,
  "details": {
    "source_id": "RLAB-P3-SRC-0002",
    "source_hash": "1990816f9b531bfb0ae679bfe6642ddc111d3cfa02596c362afd4a1ab1147733",
    "pages": [
      "wiki/now.md",
      "wiki/roadmap.md"
    ]
  }
}
