{
  "id": "870cb7da-29ec-4680-8c78-4d34a220c63b",
  "type": "task.update",
  "created_at": "2026-10-27T02:55:31.372Z",
  "agent": "codex-root",
  "session": "v1-20261027",
  "summary": "RLAB-TASK-0006 update",
  "task_id": "RLAB-TASK-0006",
  "details": {
    "status": "IN_PROGRESS",
    "owner": {
      "agent": "codex-root",
      "session": "v1-20261027",
      "token": "ced3dc29-d7b2-4642-8a1a-6f0c88c3ea2e",
      "claimed_at": "2026-10-26T18:32:26.656Z",
      "heartbeat_at": "2026-10-26T18:32:26.656Z",
      "lease_until": "2026-10-27T18:32:26.679Z"
    }
  }
}
