{
  "id": "5ed66481-12ca-4cd9-bf44-3d4c41413083",
  "type": "task.release",
  "created_at": "2026-10-28T00:16:26.902Z",
  "agent": "codex-root",
  "session": "v1-20261027",
  "summary": "RLAB-TASK-0012 release",
  "task_id": "RLAB-TASK-0012",
  "details": {
    "status": "READY",
    "owner": null
  }
}
