{
  "id": "34d5f237-87d2-4e21-8b16-8129a14d86a2",
  "type": "task.update",
  "created_at": "2026-10-28T15:38:17.912Z",
  "agent": "codex-root",
  "session": "v1-20261028-r14",
  "summary": "RLAB-TASK-0020 update",
  "task_id": "RLAB-TASK-0020",
  "details": {
    "status": "IN_PROGRESS",
    "owner": {
      "agent": "codex-root",
      "session": "v1-20261028-r14",
      "token": "aafd3b70-2b03-4d55-b569-780f6eea53b5",
      "claimed_at": "2026-10-28T09:49:17.246Z",
      "heartbeat_at": "2026-10-28T15:30:57.920Z",
      "lease_until": "2026-10-28T16:30:57.920Z"
    }
  }
}
