{
  "id": "1bdc1f19-6e4e-42c7-9a16-4541145f9365",
  "type": "ingest",
  "created_at": "2026-10-26T17:53:37.227Z",
  "agent": "codex-root",
  "session": "sound-behavior-20261027",
  "summary": "Sound Behavior來源／政策整合：docs/10-sound-behaviors/INDEPENDENT_REVIEW.md",
  "task_id": null,
  "details": {
    "source_id": "SB-SRC-0028",
    "source_hash": "09bfa748810d2b468e8954b8261789f9ae0027b635b9338e7a8165e951d7df8c",
    "pages": [
      "wiki/experiments/sound-behavior-validation.md"
    ]
  }
}
