{
  "id": "fbe6f08e-30b6-4d0d-ad25-1d55bc575234",
  "type": "ingest",
  "created_at": "2026-10-27T21:41:42.075Z",
  "agent": "codex-root",
  "session": "v1-20261027",
  "summary": "真實aec0604本機Git、最後品質及fresh接收證據",
  "task_id": null,
  "details": {
    "source_id": "V1-SRC-0034",
    "source_hash": "3783ed129b14bf7724ae0cdcd481a1d2fa4c7f572c78c3567a2144c401f8ebd2",
    "pages": [
      "wiki/now.md"
    ]
  }
}
