{
  "id": "5139b334-b58c-4ca2-b6d2-75a904e387bd",
  "type": "task.update",
  "created_at": "2026-10-28T00:16:25.649Z",
  "agent": "codex-root",
  "session": "v1-20261027",
  "summary": "RLAB-TASK-0012 update",
  "task_id": "RLAB-TASK-0012",
  "details": {
    "status": "IN_PROGRESS",
    "owner": {
      "agent": "codex-root",
      "session": "v1-20261027",
      "token": "52b796c0-fea6-4c93-b582-afd6b0e10aba",
      "claimed_at": "2026-10-27T21:17:51.206Z",
      "heartbeat_at": "2026-10-27T21:17:51.206Z",
      "lease_until": "2026-10-28T21:17:51.217Z"
    }
  }
}
