{
  "id": "cd5be887-db69-43fb-9899-808f7ca31f4c",
  "type": "ingest",
  "created_at": "2026-10-27T10:04:23.058Z",
  "agent": "codex-root",
  "session": "v1-20261027",
  "summary": "完整check/runtime849及當前UI27通過；保留真正縮放版面FAIL並進行窄修，完整goal未完成",
  "task_id": null,
  "details": {
    "source_id": "V1-SRC-0018",
    "source_hash": "d7f65067b8584f82df746935f527e7f1f0648bb1a4474b3b375082a7d844afa0",
    "pages": [
      "wiki/now.md"
    ]
  }
}
