{
  "id": "1863739d-0eb8-42e9-a5ee-0ce9c5597c5b",
  "type": "ingest",
  "created_at": "2026-10-26T18:16:32.075Z",
  "agent": "codex-root",
  "session": "sound-behavior-20261027",
  "summary": "移除blocker頁更新行的CRLF混用；不變更結論",
  "task_id": null,
  "details": {
    "source_id": "SB-SRC-0001",
    "source_hash": "6bb4f1fee27066056afb2d99bd93a59ef7fe049e513421cbf83984c72613db85",
    "pages": [
      "wiki/blockers/open-questions.md"
    ]
  }
}
